sentence	label
people speaking of law to protesters who are fighting for justice themselves...  #ModelTownNotForgotten #PAT #PTI #GoNawazGo	1
Rodgers needs to go man , didn't think I would ever say it but he has bought some shit players there  #good #enough	0
"I can't stop laughing at this. The fact that they specialize in ""Viral Marketing"" is especially amusing. ... http://t.co/9wJFiQ6wmk"	1
@artistandsocial @gspyrou WHAT $2 for an app, OUTRAGIOUS ;) 	1
Google's greatest travel hack will make flights much easier. http://t.co/A8Et9RK3WI #tech #business	0
Drinking an 925 IPA by @bdbrewingco @ Ground Control -- http://t.co/hEkaYsbQRI #photo	0
Two people got me socks. Clutch af. 	1
Tribute to a brave elephant simply defending his family. http://t.co/Mo74x8M5kA	0
@tellychakkar: Vote-Who is the most underrated actor? http://t.co/9OC9BuNaeD http://t.co/ueDA2ETs6W#tink jimmy#oters  got ter fame im	0
#Israel #raps #Palestinian #U.N. #draft as '#gimmick.' http://t.co/WCzRGou038 via @reuters	0
I'm not in enough dance practice whatsapp groups yet. #december #winter #weddingseason 	1
@Vanetbbi robert is handsome| ugly|#RDJ I love you|#你就算5隔格我都知你讲me ga|#BTW tomtom I love u too	0
Shit just keeps getting better and better!!! #ShouldOfStayedInBed	1
"My teacher just gave me an ""I feel sorry for you look"" I must look really adorable... "	1
there are things we are made to go through  to harm us but to given us a lesson to teach to someone weaker	0
@JamaicaVaper @Hifistud @OutFrontCNN @CNN This has been my point all along, that TC is proving to be #ecigs best advertiser to teens. 	1
Now I've written down everything I need to know it seems a lot more manageable. 	1
Being awake since 3AM is always so much fun 	1
Great start to the morning  #flattire	1
If we could stop losing planes that would be great.	0
I love running on 3 hours of sleep..  #ijustwannasleep :confused_face:	1
I just love being in charge of comp music :grinning_face: 	1
Ohio State putting it #OnWisconsin ... No match.	0
Pulis turned down #NUFC cos he wants to spend a load of money on 30 year old journeymen. Parish wouldn't let him & neither would MA. #cpfc	0
#notcies #eu Ebola leaves hundreds of thousands facing hunger in three worst-hit countries http://t.co/g79X9se31R	0
I dont understand tlist as I dont read inamorata I only read inamorato lmao #sorry or prob  lol	0
Powerful picture taken by a #protester the #night before #christmas. The  is real. http://t.co/EVdeheqpsj	1
One things for sure IMA make y'all folks remember me.	0
 the people #BillCosby looked down upon are ones coming to his defense. This isn't about race,it's about rape! http://t.co/PD4GUCPPKV	1
Can't believe it's been nearly 11months since my mum passed away :grimacing_face: miss her so much more and more everyday :purple_heart::two_hearts:	0
#MTVStars Justin Bieber|#net  #fast	0
Last day in #Riga! #self #finnishgirl #businesswoman  @ PK Riga Hotel http://t.co/3Svv5QciFq	0
"Well done @Conservatives, you're doing a great job  ""@SkyNews: A&E Waiting Times Worst Since Records Began http://t.co/bKkeZqtEuL"""	1
@samcguigan544 You are not allowed to open that until Christmas day!	0
Lord have mercy on us. The world's most powerful nation is ruled by two families. #Bush #Clinton #wasps #elxn2016 http://t.co/32ao1G9H5V	0
@TFLN: (281): If I had feelings, you would have hurt them. 	1
Merry Christmas love Instagram http://t.co/CcfhdT73wH :face_with_tears_of_joy: #gifts  #spam	1
@letote good thing we had enough #whitewine and #christmastrees to survive if needed. #chardsohard #fashion  ;)	1
@SP_EnergyPeople I see your response time on your DM's is as good as your phone lines.. just no hold music. Legendary service guys.	1
Another day in paradise haha 	1
So, Matt and Natasha are having sex. #WhatASuprise  #WhatElseIsNew	1
The silence in #TimesSquare for #EricGarner last night is only broken by #NYPD siren. , watch on ifussss app. http://t.co/4qJQ9lM07U	1
Carphone Warehouse call centre employees are such classy people  @CPWTweets	1
MLS Transactions 2015 #MLS http://t.co/hGIAVdLyx7|#TFC making waves again   2 b fair it will take more than 2 players to fix this	1
Sony pulled a movie bc we're scared of a country that can't even keep its lights on at night? Even motel 6 can do better than that. #Zing	0
I love the meaningful messages of automake. 	1
@melleegee it'll be ok, just get your TA to fix it!! 	1
I have to leave for school at 9am and I'm still in bed #fucktherain #wherearemyhunters #imgonnalooksocutetoday 	1
And it's freezing, yay!  http://t.co/McQJBgNY1E	1
Togepi do  shed their www.MonsterMMORPG. com #shell. fally by #MonsterMMORPG #bagon	0
then there's this @HotNostrilsrFun @Rapmonster @RBRNetwork1 @officialgumby @OrionSLU http://t.co/CwaAYwUwGl	0
@_Jencita_ congrats , so cute :)	0
@VeIvetRose @PG1888  of course, Not!	0
Westbrook 16 points on 42 shots ok ok I see you working 	1
@AlWashingnutt Yeah...me too!!!!! !! x	1
@CCriadoPerez The person who wrote that is clearly a bit of a tit 	1
When your  is so advanced people actually think you are #stupid.. http://t.co/LSGmXqneqq http://t.co/fOqATXhy5U	1
http://t.co/hh5lziJCIl #GapeLand #Super-sweet Super-sweet Lilli is simply adorable with her all-leg,&#8230;	0
decided to do a really fun thing, left myself 15 hours to sit an exam and write 3 x min. 1000 word essays 	1
love studying for anatomy :beating_heart: 	1
Just great when you're mobile bill arrives by text 	1
I just swallowed my giant lozenge. Now my throat actually hurts. I'm glad I have Twitter to share my despair. #sick	0
Welp. There goes 50 bucks down the drain. Thanks KU Student Housing.  Get. Me. OUT.	1
I wonder what Professor Iaukea has to say about the new Disney Princess...? :unamused_face: 	1
#take#a#deep#breath#it's#just#a#bad#day#a#bad#life http://t.co/YmnLzTNkpy	0
girl#beautiful#short#nose#tall#but#toshort#selfieeee <3:* http://t.co/90Itgrq4bh	0
Yay! More worthless Windows 8.1 updates. Computer still never sleeps/hibernates on its own. #fixit #fail #Microsoft 	1
@DalailamaQuots I don't recall dalai lama talking about busty girls and celebs but apart from that.... 	1
I love being unappreciated 	1
Had a nice 3 hour nap. Picking up my Chinese take-out and set to watch #GuardiansOfTheGalaxy @MyzzCryz I added water chestnuts to my dinner	0
Let's go CAVS!!! #cleveland #cavs #cavaliers #nba @ Quicken Loans Arena http://t.co/QiSPa7nC8B	0
480 W crawling at 7:30 am. Great start to Thursday. #CLEtraffic #cleveland #traffic	0
Funny Annoying You Men's Tee http://t.co/bDSBZ93PCc Great for family reunions! #funny  #tees	1
As Lamar Entertainment, putting more money in than I'm making, #tbt  having the right team... http://t.co/jZfrSfXSbo	0
the  that the #euphemism #CoerciveControl was #coined by a #MAN but is now #lovingly #appropriated by the #radical #feminist #agenda	1
Thinking I should lock my phone away for the night: #ifyoudonthaveanythingnicetosaydontsayanythingatall	0
It's hard to take people seriously who can't spell and think grammar is a type of cracker.	0
@Giraffe737 the good old days! 	1
A chunk of my hair got stuck in the blow dryer and I had to cut it out... That's always fun..  :expressionless_face:	1
Love games during the week because I don't get to go to sleep until like 1! 	1
My dads letting me drywall with him for Christmas. Just what I always wanted. 	1
My Com professor keeps talking about Twitter. ||Lel	0
@RachelRyan_ @jamieyuccas @lifetimefitness @WCCO they better!	0
##to#our#countries#special#dedication#to#ma#Syrian#friends#you're#alone#instalisten#by#heart#voice# http://t.co/jOHtHVBKOw	0
SEEING @AlpEmiel ON SATURDAY whaddddddup #legend 	1
Wow Tim Hortons Cobourg is really on their A game today 	1
look for the girl with the broken smile, ask her if she wants to stay while, and she will be loved. :two_hearts::musical_note:	0
@SouthamptonFC @whufc_official Yeah thanks for that! 	1
"The ultimate ""How to"" book..... http://t.co/u8fdrrDUXz"	0
Porygon2 #are  found in the www.monstermmorpg. com #wild. bulbiest follow @MonsterMMORPG #working	0
group message with bbc to start off my morning thanks Hannah :-) 	1
Ay after 2 hours nareceive ko rin yung message haha thanks globe 	1
I can already tell today is going to be a wonderful day 	1
@bustedcoverage  but Russell is a good christian fella, he wouldn't do that. 	1
okay back to studying for math final	0
... @NICKIMINAJ slaying in Igloo Australia's home country lol  RT > @MalikZMinaj: Nicki is SLAYING New Zealand! http://t.co/5oIm9uZNQr	1
@salgovernale No clue what you were talking about? Well that's a first! 	1
@conorcoughlan_ Being doing projects for university all day! My life is sooooo interesting 	1
Travel and tourism this morning.My favourite lesson whoooo 	1
@YankeesWFAN @Ken_Rosenthal trading a SP for a defense-only SS? Brilliant trade. 	1
@FinestDos @TheFinestSquad @KroniumSquad Oh wow your talking Skype! Cool! 	1
@sammiecurtis_ oh man. You will have to get everyone singing ready for when I'm in :face_with_tears_of_joy:	0
Exactly 1 year ago today! (via @timehop) http://t.co/m9E3NSZDIk http://t.co/U2OpTFAd1w	0
"Don't be offended when you hear #HappyHolidays when people refer to #Christmas. The word 'holiday' is derived from ""Holy Day"". #fb "	1
@hoplitnet The fact that Whites are prone to universal thinking is actually racial in and of itself. 	1
A very happy birthday to @sillybrendan - we'll be toasting in your honor tonight. @brad4word @Case4Cleveland	0
the silence tastes like wet flowers wet dead dying flowers. Flowers without life, fallen pieces of silence.	0
": When some naturopaths sell ""aromatic"" herbs the way apothecaries sell noxious poisons. #Naturopath=#Apothecary #Herb=#Poison"	1
No response always seems to attract response. The ! #aintnobodygottimeforthat	1
Still awake sooo that's nice... 	1
Oh this will end well.  RT @JonathanCohn: Military-Style Tech Finds Way Into School District Safety Measures http://t.co/uGFWTCZlVK	1
Who wanna hit the slopes? http://t.co/thjIfVDMIA	0
"Do...or do not. There is no try. - #Yoda ""Do. Do not. Try. Try again. Repeat until you get it right."" - #JarrodDavis"	0
Read at http://t.co/HbeAb2hklW the news '#Middle #East #updates #/ #Assad: #US-led #airstrikes  #serious #or #efficient'	0
Writing an article on mood enhancing foods. Telling people what to eat to be happy 	1
"@AJtedded: Aaaaaand to read ""Big Sleep"" because can't get any sleep...  http://t.co/BzEhrjZEKS"	1
@awfulannouncing I don't believe you!!!!  	1
Just realized that the name of the comic sans' creator means asshole in French #nooffense 	1
#Law&OrderSVU where rappers go to act	0
that way people get to understand disabilities and not stare at us funny wen we out and about#IDPwD#disability	0
i would tell ya, but you just wouldn't understand...:heart_with_arrow:	0
I give people a break 2 say that without my supporting cast that none of my works would of made it is tosh. Did nobody get #Extras 	1
working a double on 2 hours of sleep here we go let's get it 	1
The dude who told me money isn't everything is arguing with his son over money. In public. 	1
you dont, fish and mammals have nothing in common @1kenwilson24 @brownbearmike1 @HotNostrilsrFun @Rapmonster	0
http://t.co/kmipajconx Dont mess with a #Ninja ! #KO http://t.co/4yT7wLCqZA	0
Congrats still SASMVT for a good run. Ulitin nalang ulit ang 6-peat next year :)	0
@craftsBoy Marvellous!Sounds nothing like any jingle bells song i've ever heard!I can see you in mismatched socks,tights & cricket gear :-)	0
@cnsnews Say it ain't so, Joe.  Who would imagine a government program fraught with fraud?  Has this ever happened before? 	1
stop subtweeting :winking_face: 	0
#Video on #Jesus and #Bulldogs which is #deep and #meaningful|cough, |#dog #dogs #bulldog #religion #vlog|http://t.co/HoUeTiFR2N	1
But hey, 1 study guide for chemistry down 5 to go	0
Why everything must b turned into a disaster to avenge another disaster?What's so gratifying in forgetting tht we all are humans/Pakistanis?	0
love taking the subway alone at 2:40am 	1
Having to be up in four hours sounds great 	1
@UoCDisSupp @DuchenneNow @ActionDuchenne @Duchenne_Heroes I'm off to visit great-nephew very ill, only 20  fair	0
Getting hit on by a TSA agent who thinks my first name is Bowie #wifemeup 	0
I would have made a much more convincing Bella Swan.	0
@jimmyk52501 @MotherJones @NickBaumann I love when the wilfully ignorant embraces hate and still think they hold a moral high ground |	1
Blowing your nose so hard your ears pop is the greatest way to start a Wednesday. 	1
@burninggoats no doubt. And we wonder why Xmas makes ppl crazy?!	0
Meh...i don't think I'm a suit person.|~ Neil Caffrey||#TvQuotes|#WhiteCollar	0
#NBA players #NY support protests of #police killings/sure #money donations for #college WB coming   http://t.co/WothDOXXeM	1
https://t.co/13AvCYdxs6|Shop now  in the MALLS! TAKE YEARS OFF YOUR SKIN! SEACRET Minerals from the Dead Sea!!!  https://t.co/MIF1TIkZNa	0
I'm going to Finnish all my homework and get caught up on everything over the break  http://t.co/d1OyKPzWwU	1
Why must I pay more for car insurance when I don't have to? Don't get ripped off - trust GoSkippy http://t.co/eCmZ806Q44	0
whoever runs Yeovil Town FC twitter account should be fired. their starting line up looks like a mxit fantasy league team	0
@thei100 @Independent Nice smile 	1
So they lost....such a shame...I was really rooting for them ... #LFC	1
If that's Man U at its best they have much bigger problems than us ;) #saintsfc. Then again we're still 5th #noproblem	0
Wrapping up CROTCHED MOUNTAIN commercial tonight, and packing everything up to head up to Loon Mountain Resort... http://t.co/g0IXxNJE6g	0
Ideology in a nutshell - the meaning of life in a sentence for every perspective. http://t.co/M6GIHxEHe8	0
@ceyland89978315 All #U Can Do Beautiful Is Your #BEST Winning Is  Important Taking Part & Having Fun Is What Matter's :-)	0
And my christmas shopping is done.	0
Good thing I'm scared of clowns and my kindergarten teacher was dressed as one today. :expressionless_face: 	1
@inthisdimension @2AFight No, it's secured by the Cartels so that they can charge huge sums of money for illegals to cross into the US.	0
Morning #monday people  long know keep working hard! #MakeSussexSafe 01273276865	0
Guess its just me, brett and my mom this year. Gotta love my family! 	1
@Pret hmmm interesting 'jury's out' but edging towards the right side of 'favourable' !! #hopethathelps	0
Couldn't agree more! RT @Champ_Payne: Nothing makes me feel more special than receiving an automated DM. 	1
"I before ""E"" except after ""C,"" right? What about in ""W-E-I-R-D?""  #Tshirt #RulesWereMadeToBeBroken? http://t.co/9CFGuU4Q17"	1
@stuhirst well, people did ask where would have been without McCormack, and here we are	0
Ummm can I please have @KipMooreMusic for Christmas?! Dang he looks great tonight. Why did I not go to this thing tonight?	0
LOL and now you cant see when blocked, best thing you can do is install a different browser @Chief1787 @Hankin57	0
But someone selling a pack of cigarettes gets a death penalty  #EricGarner	1
@K_TR69 @tracieeeeee @KDunham4Prez too much of that herb. New trend of potheads contributing to society maybe? Darn that 	1
@lids4hats lids sucks officially! Will not use again good	0
"Facebook owner, Mark Zuckerberg, says ""dislike"" to creating a dislike button http://t.co/D38jb5IBmP"	0
3 hours sleep yay loving life 	1
That's me, the infamous pepper shaker replacer. 	1
Those Amarillo hops make it just right #goldilocks - Drinking a Tour de Fall @ Memphis' Pint & Dram - http://t.co/ZEVvcvjrR5 #photo	0
#All #Cute #Dude #Girlygirl #I039m #Into #Is |Please RT: http://t.co/3L4BiH19BE http://t.co/THyRbd1TG9	0
Casual stroll with lauralobaugh   Rochester  #FunInTheSun @ Key West Islands - Florida (U.S.A.) http://t.co/G24gAzZib1	1
This is not the moon. Pictures like the moon is made of light bulbs.  #the #moon :) http://t.co/4oeU3FGv830o	0
 acceptable 2 hours to drive 30 miles Cheshire-Manchester yesterday. Northern Powerhouse?	0
Extending trade and not telling the people about the extended trade. Best idea ever! 	1
@BudweiserIndia @EVC_India |Here we are all alone |You and me, |Privacy |And we can do anything |Your fantasy ||#GetMeToEVC	0
'All we do is eat, watch movies and kick the shit out of each other' :face_with_tears_of_joy: #RelationshipGoalsAccomplished 	1
thanks for appreciating me looking out of you and caring !! 	1
Look behind you # Tara # Ella # Starbucks #mytopgirls @ The Omni Santry http://t.co/6fDS3kpjc7	0
@sethedel @FisolaNYDN Until he becomes the most loved athlete in his new city.	0
@veebex haha cannot wait for monday  at it's best.. cheers	1
@honestfandom oh mature girls 	1
Photo: Cheers! #vodka #mother #energy #drink #tipsy #on #one #drink #Cadbury  #alcoholic #Friday... http://t.co/9nIao1XChp	1
Cluck! RT @DJB627: Most transparent administration ever sends password-protected documents to Oversight.  #Gruber	1
Hey what do you know, one of the witnesses supporting Darren Wilson's story lied! And is racist! Mind blown! http://t.co/0k25FE024w 	1
Bhopal victims don't get justice aft 30yrs but don't find place in prime and a man traveling in business cls is prime time news.. 	1
:flag_for_Faroe_Islands:🇱🇱🇴🇼 THIS:|#TSU website now worth $1.5 Million!||You get paid for posting!|http://t.co/OXybfwwWb6 http://t.co/3rW8P7GfW8	0
@Heathmusic So...I should click on the link in your private message to see the nasty rumor going around about me?  #boohackers	1
Wearing my @BriBrows22 rangers shirt, flipping off a crowd in his hometown of boston. So much  http://t.co/e7W8prHTE0	1
@antoineraps: @edifyin how the fuck are you up now? Ho! Saturnalia nigga 	1
Sexist article in the Daily Fail about men wasting money on cycling - accompanied by recommendation for a handbag costing £999. 	1
@BlogOfErised so I gave up and am now heading for bed orz	0
"Pepe's hair RT @Tife__: Palacio's hair...""@bombguy95: Ronaldo hair..""@Ms_Nini_: Messy hair :black_heart_suit:"""	0
@TheTweetOfGod Even you have to think the Religious Freedom Restoration Act in Michigan is ridiculous.	0
i'm really stoked about going abroad in the fall. and well next week but that's for completely different reasons. #imissmyboyfriend	0
We live in such a small world these days - the #LAFire is a story at the end of the Australian news @ABCNews24	0
What do you call a Chinese millionaire?	0
Ok watching how hurt parents are when their kids decide to elope definitely makes me change my mind about it. Small cozy wedding it is 	1
I can see it in your eyes.. #Kingofpop #mjackson #michaeljackson #invicible #breakofdawn #king #is  #dead :purple_heart:... http://t.co/FCepZG7UUr	0
"ï""?#Depression and #Abuse are sadly a part of many people's testimonies My Monster of a secret: http://t.co/laGCC2eTH5 #DamonLeroi"	0
Um, really @RollingStone?  #nothanks #UVA http://t.co/8ARdG99p8L	1
EXO COMING SOON 2015||Better pray this is better with 10 members *sighs* But either way, obssessed fans would still be obssesed ._.	0
Great, I've got a lung infection. This is fun. :/ | #notfun #miserable	1
Imma kill all you SOBs! Jk #lol  #RedEye	1
@xiaomi has passed @uber as the world's most valuable #startup! #growth #nyc http://t.co/3b7F9RoSAW	0
"Race 5 at Sandown dogs tonight sponsored by ""Dandenong Budgie Club"" |Hope that's a joke.|Love a seat at that table  #nerds #getalife"	1
Love working hard trying to fix other people's fuck ups 	1
Obama wants closer relations with a Marxist nation... I'm SHOCKED I tell you!  SHOCKED!    #cuba http://t.co/as75A3kJ9z	1
#Germany -- #ECB's #Weidmann #says #German #2015 #growth #may #be #better #than #expected. http://t.co/gxFSC1mQy5 via @reuters	0
@enigmaniac1 amen, bless you Huda, means a lot. You too.	0
#Palestinian #Authority -- #Abbas #trades #stalemate for #confrontation in #ICC #move. http://t.co/rDKOFf0s39 via @reuters	0
2AM on Christmas Day, and we're heating up Pizza and Breadsticks. #theboysarebackintown http://t.co/4PNPfk28LZ	0
See, this is why you shouldn't use version control!  #notjustWordPress... ||http://t.co/uCtj9WTxzl	0
Today is just not my day :pensive_face:	0
I can be mad at you for a matter of 15 min then I can't stand not talking to you.	0
Love ya Jerry, but what the heck was that?	0
http://t.co/NA81q6lLGp #SchoolSystem Update #Textbook Lies to support #Evolution theory. #Tco... http://t.co/UERNS7uCoM	0
@TheSunShowbiz @ScottishSun Love her. please publicise her more. 	1
Double standards are always a fun thing 	1
Ooh! Someone knows how to click the 'Unfollow' button. I'm impressed!  #beforeCoffee http://t.co/Cm1UldR6d5	1
I've changed gazilion times the #java configuration NOT to check for updates. It's nice that every five minutes asks me for an update! 	1
House adjourned again. With this pace, dont expect the ache din to come to Parl n u cnt blame d Modi Govt fr this  #RajyaSabha	0
@TNADixie @IMPACTWRESTLING @DestAmerica Fuck yeah! 600 more viewers! 	1
@PatWilsonInfo Huh? It's a graphical representation of what's happening. Nothing is out there to take a photo!	0
Those that are  #BritishRoyalty should Not presume #Titles or do any #PublicDuties	0
@AdamRubinESPN # SHOCKING 	1
.@ChipBrent I love the #gamergate concept of harassing and spamming porn at any critics as proof that you're not a hate group. 	1
@Quammunist Ben were you going to pick up your pizzas today?	0
Hi Orgabeh, so we meet again. I think you're my soulmate. :smiling_face_with_heart-shaped_eyes:  zzzzZzz :tired_face:  #patience	1
Gotta go back to work tonight	0
I hope we get an ice palace and an invisible car #SPECTRE 	1
So you think anime is for kids... Tell me again how many times you have seen Frozen #anime #is  #for #kids #Frozen	1
Why do I have to have a good game then a bad game and then a good game then a bad game again. :expressionless_face::pouting_face:	0
@BrDieteticAssoc bring it on. Will look forward to the Easter one more :-))) funnily enough i crave salad and fruit round xmas now!! 	1
#QZ8501 asks permission to #takeoff: #towercontrol of #Surubaya: yeah..y can go...away.	0
@RadhikaMukherji y r women considered inferior2men by society even wen in most of d families 2day men need women4decision making!  :D	1
@Funny_Truth: Substitute For Chicken Nuggets http://t.co/jeja9wJYKu uhm no thanks	0
Not everyone will understand you. That's life.|#goodnight|#gatecrasher http://t.co/Xjqr57TEXS	0
Where is the #TortureReport from Showtime's Homeland? 	1
#Minivan #Mom #Ebony #Wilkerson  #Guilty #By #Reason #of #Insanity: #Judge: A Florida judge ruled Friday that... http://t.co/J5bLfeJXft	0
Bush Govt to be prosecuted under Geneva Convention for torture after CIA methods & VP admission exposed. http://t.co/SV4j6clfUB 	1
The #blackbrunchnyc hashtag got the racists goin up on a Sunday...:unamused_face:	0
 going http://t.co/LBB7vzV6yx	0
@bayer04fussball draw, @s04 draw, @Everton going to lose, Pelle on my bench in fantasy, been a fucking shit night for me.	0
@sharna_woodcock well the pain isn't makin me feel sick anymore so:thumbs_up_sign:be all better for the big fella :father_christmas::wrapped_present:	0
@slavetothemic thanks for sharing Mike, your opinion means a lot to us.  #orisit?	1
@TargetZonePT :pouting_face: no he bloody isn't I was upstairs getting changed !	0
67 is such a beauty :unamused_face:  #manitibaprobs	1
Photo: #Say it loud say it #proud! #Nope #never!  a quitter and will never #be... #always #winning even... http://t.co/CW8qeDU7NJ	0
Well that's me living till I'm 200yrs old!!! #sarci   #wit #low #constant http://t.co/8NzMFso9Do	1
The winner goes to this stocking! They bribed me. ;) http://t.co/JagIuUrxe7	0
@juskoniall funny joke there bae...	1
Happy new year to meeeee... http://t.co/ZLtXiVB7qH	0
I love finals week! #justkidding  #stressed	1
I'd rather you know and be upset than hide it for you to only question things later	0
@knowonehome: It's really difficult not to bark back at my pms-ing daughter. When bae tweets about you <	0
I had the best New Years!!!! Spent it with the people I love & I fucking loved it! :smiling_face_with_heart-shaped_eyes: Such a happy camper right now! :face_with_stuck-out_tongue_and_tightly-closed_eyes::green_heart::heavy_black_heart:️	0
The Interview has been cancelled, not because of north korea but because the immense comedy would blow our mortal minds 	1
@AYJamal_ wesay Yar her date was good :winking_face: I guess she(in first meeting)wanted to b seen with a girl or smth(in hindsight I found her mashkook)	0
It's being 200 yrs since the west had their industrial revolution but in 21st cent Ghana, an industrial de-revolution is happening. 	1
LOL..It was an RSS agenda modi bribed UN officals to make yoga day international..  #secularindia #AntiConversionLaw #hypocrites	1
Listening to a guy who decimated his team explaining to another how to build teams... hahahahaha aaaah.  #tragedy	1
@michelledean @AVAETC not playing out in the provinces like, oh, Mississippi. 	1
Sunset for January 04, 2015 at 04:39PM! Temperatures: 6℃. It's Partly Cloudy.	0
Late night snuggles with my boy :purple_heart::two_hearts:	0
Is holding not a rule anymore?	0
Shameless' accounting firms make vast sums advising rich on how to rip off taxpayers - accounting chief|http://t.co/9BSDuJAKXb < 	0
@parisbreedenw You need to, it's an experience to say the least	0
#elf #why not  moving http://t.co/ZcrJaOwPqZ	0
@TMJ4Steve @AlTruda73 not knowing that it was about covering the points hasn't kept us from winning two weeks and almost winning a 3rd.	0
@Only1Neets Probably a Nigerian. 	1
@TheKaranPatel u might b d bigest fan of srk but i find u better actor than him sayng it just fr sayng but realy mean it#expression king	0
@darrellr79 @EBJunkies I'd prefer the slew of #Ferguson protestors across the US...they stop traffic shut dwn bridges	0
@cnsnews I've heard liberals defending bombing civilians along with terrorists w/o trial but still claim Enh Interrogations and Gitmo evil.	0
