sentence	label
@laurenfleskes hahaha such a 1% town	0
Found out the reason that weekend closer makes my life miserable is because I'm atheist. #hypocrite #atheistproblems #serverproblems	0
Ugh, I would give your first-born for some Pepto Bismol right now. #upsettummy	0
How does #bigdata and #analytics look compared to the #cynefin cause/effect decision framework? https://t.co/LHSXbg8tL4	0
@BrandonTierney I also support instantly murdering 12 year olds with fake plastic guns in public parks...	0
Rants about being pregnant and judged for buying a bottle of wine. Poses weekly for belly pics in front of wine rack.  or #fail ?	0
@MikeReiss fading the public doesn't just apply to gambling. Do the exact opposite of @MatthewBerryTMR and you're in good shape.	0
"Day 4 ""joyous day"" #decemberchallenge #picture speaks for itself #costateguise #beach#peace#2nd home#... http://t.co/1jXB5QCOxO"	0
NEW #HipHop MUSIC:> @Flows201 - Crack Music: http://t.co/PQmUEmlJUf #JerseyCity #NJ #NY #BirthOfAWinner	0
Lifes like a bird, its pretty cute until it craps on your head. #Gharwapsi #72HoursOfCrazy #PowerOfFive #lol  #AntiConversionLaw	1
Yay for getting pink eye again!  #whyme	1
haven't talked to you in days. that's cool I guess. 	1
@sowinski521 annnnddddddd your opinion is irrelevant	0
Finally went to the doctor and feeling so much better.	0
@DrunkVinodMehta If #BJP joins with PDP, then CM will be of PDP. Only way to have a #HINDU #CM is to take support of Abdullah family 	1
Thank you @wizards_magic.  Requiring Facebook to participate in Twitch Chat is really a good way to push away interested players. 	0
I don't have to respect your beliefs.||I only have to respect your RIGHT to have them. ||#atheist #atheism	0
I love hearing people's explanations about the dating world in America in the library while I am studying 	1
@MatthewWRossi getting power from wind is so outdated and unsightly, we should be siphoning it directly from the sun by now. 	1
@FUCKCRUCIFIX: COD AW SERVERS #OFFLINE 	0
Aren't you just loving the snow?  #Stockport  http://t.co/JhG0LxAun5	1
"My grandma tells me she made raviolis to eat.. You know I yelled back ""fuck you I don't want no ravioli nigga!!!"""	0
Hope Tulisa doesn't get a job back on #xfactor next year	0
@BudweiserIndia Now, Tomorrow productivity at work would be hampered. #GetMeToEVC	0
Got nothing against Muslims, but fuck these Islamic Cunts are disgusting :/ #sydneysiege	0
@sirmlivesey :-) Go for it. 20th Century Fox copied me and did 21st Century Fox, after all ... , I hasten to add *very* unlitigiously!	1
@CryptoDabbler @CoinMKTCap @CoinTelegraph you talk about biased behavior. go read some of the paid articles about paycoin. 	1
@Johnnyebs06 oh joy, now i get to have even more of them in my living room!  #putyourtoysaway #badboyfriend	1
Love working and be exhausted all the time 	1
:fisted_hand_sign: #fistbump #positive #focus #starve #distractions #werk #motivation #createpath #uplift #success... http://t.co/Nzpp4X5j1f	0
Oh look - wrapping presents is SO easy...here's the video to prove it!!!|http://t.co/f6QFevN0Ka	0
Harry's literally such a good person it hurts my heart BYE #InternationalHarryStylesDay	0
@Neilby70 @ParkzTheDon @TonyBrown03 @goodgary99 @GazTheGooner84 @LosDaGooner nice what you cooking me:face_with_stuck-out_tongue_and_winking_eye::face_with_stuck-out_tongue_and_winking_eye:	0
Losing the keys to your car before your have to drive yourself to the airport to catch a flight is awesome. 	1
@muellnerpaul @jamieyuccas @KimJohnsonWCCO @KylieBearseWX don't forget @Ali_Lucia and @AshleyRobertsTV (they're as smart & kind as lovely)	0
Well throwing up at 6:00 am is always fun :white_smiling_face:| 	1
@moofer1972 @abc7newsBayArea That's fantastic up to date news. Also 	1
If you gon' judge people who drink and blaze FOH Go choke on some foreskin	0
So glad y'all can be awesome now.. 	1
I love the hypocrisy of the holidays. 	1
@BIGJOEONTHEGO #ThingsBetterThanTitansJags napalm hotwings #bigjoefavorite  love the show #keep it real	1
 - Road safety campaign donkey killed by car http://t.co/hnWYc5jp13	1
@jonmorosi It took 4-5 hours but in the end, Morosi was right and Nightengale's sources were wrong.	0
@RedFMIndia @SunburnFestival |Answer 2- More than 150 artists |#WinSunburnPasses	0
@bensaufley @jimmystagger @NERevolution @GilletteStadium actually I believe Henry is undefeated on Turf in @MLS @TimbersFC 	1
Prevents blood clots! More like stops blood circulation #SurgicalStockings #attractive  http://t.co/XZuXjZ9qsN	1
Let's just not pretend for once. .	0
FOR SHAME .. THIRD TIME ... Pregnant Duchess wears designer dress for the THIRD time in New York http://t.co/hKXpFkKWZ0 via @Femail 	1
Love being called into work on my morning off after not even 6 hours of sleep.  #thanks #splitshift	1
Lol at docs who don't know what they're doing.  #fuckthat	1
@stephen__tommy and yeah I set it at 130 not 150 because overworking your rookie pitchers is totally okay 	1
@daddy_warpig @soulbrotherkab @Smirtington @quietuswolfe #GamerGate , now with weaponized Ninjas. we trained with Assasins Creed. 	1
Is there even math cells? if there is they're not working ahhh hahaha #mathisfun 	1
Chillax Bitches. :face_with_stuck-out_tongue_and_tightly-closed_eyes: why is my face so squished. #fireball http://t.co/2J6NiWuIPJ	0
Thank you @EmmeRylan for live tweeting my morning 	1
@sscottamatthews wtf where did you go	0
@the_cheshirekat @TheLividPatriot Ya cause their country is calm and peaceful from Everyone arming themselves 	1
:face_with_tears_of_joy::face_with_tears_of_joy: I'll let you and BB know how I get on xx	0
buzzing for school on monday.. 	1
Any Hindu who tries to defend his religion is a Communal.  #Gharwapsi	1
@hamackey @cspanwj an e-reader would definitely help save my life if someone broke into my house. Good call 	1
It's always nice when a teacher doesn't leave lesson plans for their sub... 	1
@vicenews halting heroine overdoses instantly? How will the music and film industry block that one wonders?	0
@ArranArmitage because I find people with different ideas and ways of life interesting.	0
Yes it is much more logical to support criminals & attack police officers for protecting life & property. #HandsUpDontShoot 	1
I can't breathe! was chosen as the most notable quote of the year in an annual list released by a Yale University librarian 	1
#working.blues.enough.vacation.days http://t.co/zSTyQiRUt5	0
I'm kinda missing summer @barbiegirl678 .|.|.|#summer #2o14 #bestie #alena #bestfriend #idek #we #cool  #chips #food #followme #ifoll...	0
@CommSec Home page at 8:30am shows Dow -51.44 but it's +102.75. Can you make your home page stats more real-time pls? http://t.co/2qTC5AKxNf	0
#If we're  #careful, #literacy #will #become #a #historical #blip: It's a summer... http://t.co/fl2FomCYXU	0
@DJNoreenKhan @iHaroonRashid the only scary Bollywood film I've watched is Bhootnaath 	1
#NYPD did  comment 4 this or provide its own internal #statistics w/|:police_car: involved :skull:s & the info has not been given 2 the FBI since 2006.	0
#Aussie #gunman #was  #on terrorist #watch #list, PM #says: SYDNEY – The gunman who took 17 hostages in Sydney... http://t.co/ibnxdPtu3W	0
Bored? Check out> @dailypotatonews newest article - each word is linked to a ridiculous website! Try it out! http://t.co/FsERGoBKnq	0
#bitch #bitchy #badass #lol #laughing #jokes   #funtime #funny #fun #ecards... http://t.co/9di1xjv9uk	1
home alone aka turn on all the lights #scaredycat	0
When I'm doing my hw at the same time with watching series. #1am #now #still  #finish #my #work! # http://t.co/4EQjloPwnX	0
YOU>@RBRNetwork1< DO NOT represent ALL blacks in fact, most reject you @Anan_VII @JoeHilgerman @1_Free_Man @ABPT_Rocket	0
" @emptynetters: Penguins cancel morning skate, which was an optional, due to icy road conditions."""	1
Well my mornings going very nicely:smiling_face_with_smiling_eyes: 	1
I just earned the 'Photogenic Brew (Level 21)' badge on @untappd! http://t.co/3slfluggKx	0
 We cram 5 minutes before an exam and get a tag of qualified person.	1
see, that MIGHT show up on a background check, and you'd be denied its a catch 22 we have the right to self protection @serpentina66	0
It's just SUPER to be ignored when you put out a desperate plea. 	1
"@UGpk yeah in the ""honour"" of the picture those lyrics sketched ... :flushed_face:"	0
What an Irony! The Police divide us, The Terrorists Unite us! #Terrorism #PoliceBrutality 	1
@CommunityMike what's the law for parking on a residential street, on the opposite side of the road facing the wrong direction? #curiosity	0
2014 was the year @Fionan_b and I became Lords :crown: #watchthelordman	0
@sophiaqualquer what for ? waste of time...:)	0
I feel she didn't love me :/ :( :( #im  #ok	0
"@Parlett316 ""Dirk's got a lot of moves I'm trying to steal."" - Kevin Durant on his one-legged fadeway"	0
i decided to become my own boss to have more free time.. now i have no time left whatsoever. 	1
"To all those who held back in #2014 start again in #2015 as.. ""@SanFranciscoVC: It's never too late to start! http://t.co/01ziUH8myE"""	0
@benrhodes I bet you're gonna be outside today, its soooo warm, T-shirt and shorts weather :flushed_face::smirking_face:  #Funny	1
@MattHDGamer FUT14 ofc, the corners <3___<3 they where faaaantastic 	1
Just seen the result| What the actual.... #saintsfc	0
Girls with British accents.. :ok_hand_sign: On point.	0
@TylerScruggs @Tatious We're going to Hotel Vegas. It's a 1968 themed party.	0
If you don't want Hall to eventually ask for a trade then hope for consistency in the message. Change too much you might as well start over	0
Watching the move 'Begin Again' and the verisimilitude is overpowering, it's like I'm back in the 90s music business again.  	1
When you show your valid 16-25 railcard and shes charges you full price anyway. Great service from Tamworth  @LondonMidland	1
"Song of the Day: ""Love Like Winter"" - A Fire Inside."	0
i just loveee bein short and having my sweatpants go all the way under my feet its so fun... :pile_of_poo:	1
just dropped my new single||it's me||i'm single 	1
OMG! #Berlin is so fashion!  #vscocam http://t.co/J6qrlxv82z	1
@iHrithik |do 4 fans!|http://t.co/TVgJXJy9DH|SmartPhone APP PAYS you & YOUR FANS!!|See-http://t.co/AlppO5hIe5 |Go 2: https://t.co/3D4325qzyr	0
"Just realized I haven't watched this weeks episode of Degrassi.  I ""eventually"" get around to it.  "	1
oh yeah,  its official #im  #crazy http://t.co/bgcLDJQIR6	0
Going to sleep a solid 30 minutes earlier than last night!!! #success #justwhatiwanted 	1
"@djaznh @cnsnews @klshrews2 Obama , like DiFi with #TortureReport is using the 'scorched earth"" method.#tcot"	0
This pressure is unreal. Keep it up	0
Just a hunch here,but I think Steven Gerrard is leaving,possibly going to the MLS  #hesnodeed	1
We want turkey!! 	1
The world is such a smiley place. :flushed_face: 	1
I'm not going to survive today w/o breaking down in tears at least twice and possibly passing out. All nighter @the library was a bad idea.	0
#oldfriends#are#old#anymore http://t.co/ZAS59mWKBw	0
So despite the fact that I was up till 4 studying and had to wake up at 7 I think this day is going to be great :unamused_face: 	1
Today has been such a shitty day	0
The oh-so-classy [] @SamuelLJackson also belittled the #ALS #IceBucketChallenge in his disgusting little video.||#NotInMyWallet	1
I picked a great week to start a new show on Netflix.  #HellOnWheels	1
@UberFacts: Men with shaved heads are perceived as an inch taller and 13% stronger than men with hair. @KOJAK_M	0
#sotrue #ihavenolife #misshim #lovehim #haveabetterone #Justin #no  #justinbeiber by grandtheftauto_five_troller http://t.co/KShHps7knq	0
That 2-hour sleep put me into hyper mode 	1
My stomach is a Wonderland for gas inducing bacteria. #blessed 	1
: When the looks that are nurtured by statuesque beauties are nurtured by the skinniest supermodels. #Statuesque=#Skinny #Look	1
The downside to working in fisheries and conservation is that you can rarely afford the cool things that promote your job 	1
ruling party in power#central#state#misusing their power#PM speaking only in foreign parliment#pm to visit out side india during session	0
Pretty flipping cold outside there today I tell ya what	0
Why does sue give bonnie anxiety and stress pills 	1
suddenly w-wada  http://t.co/lwdLPpuDSj	1
Thanks to #TeamIpswich ED for making the news crew and I so welcome this morning, as they always do. #BlackFriday filming #ItWasQuiet 	1
It's okay, you know playing loud music during quiet hours is perfectly fine..  #somepplhavetostudy	1
@carnsoreboxer you'd really want to watch that!! #excessivecomsumption !	1
I take blazing hot showers so I can get used to burning in the pits of hell. #ifitsreal 	1
Whoops. Didn't know I had to live up to other people's expectations instead of mine. Let me just fix that.  #sorrynotsorry #soz	1
@Alan_Juventino I don't blame you bro, if i was married to @ClaudiaRomani I too would support Milan :smiling_face_with_smiling_eyes: http://t.co/8aTrR8ZEiE	0
I love putting up the Christmas tree with the fam:white_smiling_face:️:christmas_tree: #christmastree	0
@goodgary99 okay went to court the case got adjourned till January.. My backs been playing up so in some pain :weary_face: wbu? X	0
JLPT tomorrow. I am feeling vaguely confident. But just vaguely.	0
So that went well 	1
If BJPee hv balls ,do dare to lift ristrictions 2mro ahead of Modi's #Kashmir visit,Kashmiris wl show u how much thy love #Modi.|	1
@kirsch71 @united I hope that all those people who missed connecting flights take joy in this wonderful experience.  #sorrynotsorry	1
Someone stop Obama! USA only should have relations with human rights loving nations like Saudi Arabia. Not terrorist Cuba! #Cuba 	1
"Video: By @sororitypups ""@dipmagazine #wifeyseries Drops Today, with #covermodels @erickaajanae and... http://t.co/ir1K325lOz"	0
@SrBachchan Can U use Smartphone?||http://t.co/Q2WB7riAvK|SmartPhone APP PAYS you!|See-http://t.co/RDlRuGN0iE |Go 2: https://t.co/cpJZkEgNe7	0
Sessions!! #why  #scary #canary #sydney #australia by lavin56 http://t.co/RS4WSrpsMJ http://t.co/EWBWx6ZIn3	0
@saintsfootballc: Wenger slams referee http://t.co/HJMbnHaPMf (Sky) #saintsfc ha ha ha ha for being too blatantly bias towards them?!	0
@bdstratton @csimps0n well aren't you the brightest bulb in the chandelier? 	1
Thechicago firehouse restaurant goes up in flames.  #chicago #fire #cfd #workingpress #cbs #wbbm... http://t.co/H7VwVUry8P	1
Today is awesome 	1
#New#color#new#beginning#new#goals#dont#giveup#never#life#should#be#easy @ skdar http://t.co/bzmXE0K98i	0
@wecameashailee: 10 HOUR CAR RIDE AND I CANT SLEEP IN CARS YAYAAYAYAYAYAY.  have fun bff!	1
There was a shooting in my old neighborhood where my family lives. Praying everyone is okay and stays safe :heavy_black_heart:️	0
Cannot wait to be home but gonna miss alot of people :thumbs_down_sign: ah roll on the new year :thumbs_up_sign: #sligowillbehithardagain	0
So glad i work mornings now 	1
So happy i havent gone to bed yet 	1
To be honest the tide was high at the beaches in #lagos and it got higher as the night crept up http://t.co/gkwKJvTrku	0
World's greatest wars can be won with mind. Invincible is the one going on within mind. #lifequotes  #copycatsays	1
Happy Monday!  Hate mondays.	1
can the next person who wants to educate me on any point please be very bloody educates before they speak to me, getting bored now	0
@carlyaquilino:  weird http://t.co/ApFZyGEtVr @gampnasty	0
Take me to church...,.	0
#notcies #eu Foreign Affairs Committee MEPs to discuss Lebanon with prime minister http://t.co/vO8qmlP1Gv	0
Towing company commuter car being towed.  http://t.co/O3NbsLQahp	1
"@DailyMirror Great job on reporting on a mentally unstable man and calling him ""drug crazed"" "	1
The @PuneLUG moderation queue is flushed once every one planet Miller hour! 	1
@SteveSGoddard Steve, Steve, Steve. That's Data. You'll never win any hearts and minds if you don't appeal for the poor polar bears 	1
I just LOVEEEE finals soooo much . And not getting any sleep is the best part about them :astonished_face::pistol: 	1
All hell is breaking loose... Ahhhh everybody freak out 	1
I have #OTH playing in the back ground at work....ohhh #naughty :p but #FUN	0
Being able to think your self angry is such a nice gift to have...  #ItsACurse	1
@shaunrmcgregor yup it must be good to be ivy league Educated because it does alot of good 	1
So if three geeks can bring down the whole of Microsoft and Sony networks..my annual firewall subscription is worth every penny!||	1
@Johnny_Volk @ESPNNFL Hmmm, Next year we'll be saying, teams that moved from SD to LA.  	1
This week just keeps getting better and better 	1
I miss the days when all my close friends lived in the same city.	0
http://t.co/6mNkIirqSL #TeenAnalCasting #VIRGIN VIRGIN ] cute teenage virgin playing in her hotel room in tight blue gstring underwear!	0
8ams are just so lovely. 	1
Mens Football clearly know how to have a good time.....  #archiesday #anychanceofasocial	1
@winelibrarian happy to be of some small service ;) @Case4Cleveland @brad4word	0
Happy New Year all my Twitter people. Hope you have a happy and successful 2015! Lots of love :face_throwing_a_kiss: #2015season #2014sucks	0
@94irwinjb I'm so persuasive lol 	1
Marvin Lewis clearly thinks very highly of Johnny Football  #norespect @amicsta	1
I love math, I'm so amped for my final like 7 hours from now. I hardly studied for it. #IBeenDoingIntegralsSinceThe5thGrade  :smiling_face_with_open_mouth_and_smiling_eyes::face_with_stuck-out_tongue_and_winking_eye::face_with_tears_of_joy::persevering_face::face_with_open_mouth_and_cold_sweat::tired_face::confounded_face:	1
Just a friendly reminder! #motto #advice #you #are  #defined #by #your #past http://t.co/Wmpp8Iy3gW	0
BJP-CONGRESS nt disclosing detail of 3600 cr. donation received,still Media/Bhakts questioning AAP  #MufflerMan http://t.co/eMUWoK00Tl	1
@McDonaldsUK how do I give feedback on some food I've just.  happy	0
@WiseManSi: Your opinions don't affect me. I'm going to keep living my life.	0
I hate babysitting when I'm sick because all I wanna do is sleep but I can't :pensive_face:	0
Sneezing when you have to pee #jusygirlythings 	1
Down or Not is down right now. That's  for ya http://t.co/f4WRhmHVLG	1
@treacle1690CCA @billyf73 good old JK landing people in trouble again, ffs William i thought you were more savvy than that 	1
I keep telling my friends I'm busy they need to stop blowing me up but they just can't stop  http://t.co/BH5IW1OEJM	1
marty posts FACTS with PROOF you? you make shit up @RBRNetwork1 @IndyEnigma @TheOldBreed1775 @jus1314tin	0
@johnsheehan10 @Matt_Brickman I mostly follow my lists, but I dip into the full feed randomly.	0
@XboxSupport hello, can you give me an guess when Xbox core services will be fixed?	0
So I heard a college dropout is offering a graduate from best College a jawdropping package! 	1
@KimiNozoGuy @Alison_prime @SportzPunz @IvyTwisted @shitpostman Probably folks like #FullMcIntosh who don't buy games.  #gamergate	1
"Song of the Day: ""The Lights and Buzz"" - Jack's Mannequin."	0
Really love when the @DASHBus  is over five minutes late on the cold days. Feels like Metro! 	1
Difficult And Happy in life should be enjoyed. Because Life Comes Just Once. So He Went. So He Will Not Be Back. || so ez	0
Don't you love when guys try to give you their number? Keyword TRIED.  #backupoff	1
 is too complex a word for him to understand @BigJdog916 @RBRNetwork1 @DywanWII	0
Library computer has frozen again #shocker 	1
@ForexEric @HeidiL_RN @unsavoryagents YES! Vote for SATAN (@HillaryClinton) in 2016!!!! 	1
"#notcies #eu Liverpool workers ""miscarriage of justice"" victims http://t.co/KKyxaCu18R"	0
"Love how the adverts for the woman in black 2 say ""you won't sleep for weeks""...way to sell it to me :flushed_face:   #SheNeverLeft"	1
"I have an ""attitude"" because you think you're hot shit at a buffet restuarant. #lifegoals  #sideworknazi"	1
Girls who can rock this thang~ #PrincipalSwag  http://t.co/5eCiip7D3j	1
@Sanisanko Sig-ni-fi-cant witter 	1
Thanks @ahtohg for connecting. Always look forward to exchange thoughts n ideas with #entrepreneur working on #green n #sustainability	0
@Bungie @DestinyTheGame thanks for plan c two weeks in a row! Getting rid of exotic engrams is also an amazing move! 	1
Just snap chatting my sister a few times.. #shelovesitwhenIsendthatmany  http://t.co/x1b1DppHFx	1
@MaggieWinter21 your last retweet though 	1
Oh god I just so happens that i love really LOVE slow internet #slowinternet 	1
@OpineJ There's no personal responsibility anymore. You can't expect anyone to think. 	1
People who lie to me really help with my trust issues  #twittereantaboutlife	1
Some #tblightning action along the boards at @amaliearena in #Tampa #fuji #x30 #boltssocial #bethethunder http://t.co/eX5dRuepkM	0
@GetsThruBuckner no shit..it's called 	0
Merry Christmas @Battlefield @leveluptime @dirtydeathdog @zachulon @covernode @YaraTwit @VisceralGames XD Thanks for making #BFHardline ^_^	0
What is the most important thing that you should do today? -- Breathe. http://t.co/Xp3nNJQMHW	0
Oh noes! The night train Berlin-Malmö runs only during summer! http://t.co/nJYk9hf6PQ & me who was planning a long comfortable train trip :(	0
Why is ISIS an acronym for words in English? 	1
@KimKardashian cropped her own child out of her picture. #motheroftheyear  http://t.co/fLEYWkFyZQ	1
Rolls-Royce, as envisioned by the wonderful people at Mansory #rollsroyce #purple #customcar  http://t.co/gbK733wrZ3	1
@dawncflv @MRbelzer he's the detective!!! lol  #OrTypeCast	1
@EarthPix: Adorable little white tiger http://t.co/GmFru7GmiR	0
" #A #TERROR #ORGANIZATION .... #Hamas man killed, 3 injured in ""suspicious explosion"" in #Gaza http://t.co/lzNIhVqHFI #Israel"	0
Absolutely love being harassed by a group of twatty adolescents on a late night shop 	1
Come to jhb to play volleyball on a fake beach  #work http://t.co/yS6wkgvT5y	1
I got ready and then got to school and parked in less than 12 minutes! #miracle	0
#notcias #eu #europ How Santa Juncker can bring the gift of a healthier EU http://t.co/f6h25c4zsu	0
Oh this is back in #AdvancedWarfare XD|#JustCODThing http://t.co/qAP5SgoQnh	0
Bae had an energy drink and wants to stay up... but I'm so sleeeeeepy. #love #sleep	0
Ask Mystic Mona YOUR question! Psychic View, weekdays at 9am (PDT) 347-850-1494 http://t.co/JCowWkMNQH #BlogTalkRadio	0
Hahaha! @jamieyuccas enjoying the #selfiestick I got her for Christmas! http://t.co/2aNmDutKtX	0
Another one of our support vehicles modified for Iceland service. #Bigfoot #LANDROVER http://t.co/NRXO4gFG6E	0
@OuttaHerrrrreee well I face peyton today in my one league so I hope he only has 2 TD passes and they're both to D Thomas for me lol	0
Iiiiiiii have the best boyfriend everrrrrrrrr.	0
Has @CNN @donlemon shown up to speak with #ZemirBegic family yet?	0
Congratulations @adele_ferguson - so well deserved. I hope you enjoy the  of this notification from Twitter http://t.co/5lZDDDC1Hx	1
Follow> @idealmusicmgt and get your FREE DEMO of their industry buzzing app seen at http://t.co/5GKFlBKr40	0
Glad I'm up at 1am 	1
Sad to hear about @StuartScott passing. His family and friends are in my prayers today. #rip @espn	0
I love 14 hour shifts  :weary_face::weary_face::weary_face:	1
@TheStalwart @M_C_Klein @matt_levine @reihan @charlescwcooke and what about the blacks you guys they don't know what to do with money 	1
@JenniferAldredx yeah I did, because it didn't show the convo and stuff, was gonna text it you but NO :)	0
@erinava as long as it's for taste purposes, that works for me. Are there any meats you like?	0
On page 35 of 357 of Hogfather, by Terry Pratchett http://t.co/k1u72J9FgF	0
@bianconerifan @JuveFC1897 LoL its not that bad, budwieser is bad, its like drinking water from the tap...	0
Hit Them Angles And Duck Face To Hide Those Wrinkles ; ) #ThatsABossBitchRightThere . . . !!	1
"Lawyer on train to other lawyer talking about ceiling ad- ""who would even read that? No one's going to notice that thing..."" "	1
Sailing-|×|#me #selfie #ootd  #cool  #cute #girl #tumblr #black #style #rock #punk #vsco... http://t.co/sDn3W9Kqvk	0
The power went out in Delano. #blackout in some parts.:white_smiling_face::party_popper: Still #HappyNewYear everyone. #besafe #goodnight	0
Comcast, greatest customer service on the planet  #comcastistheworst http://t.co/0fRUac4tBv	1
@LR_Lam you mean... it doesn't mean 'so much hate'..? .... oh..... orz	0
Wheres the rodgers in brigade 	1
also sick names 	1
Im aware that NYE celebrations are usually laiden with false expectations,I'll just be happy to close the door and kick 2014's arse thru it.	0
!! @DatWaveMagazine #2n1Edition @Marvelousuk @MAZIMONTANA @skinny49 http://t.co/oRT6ZYfGhx	0
Fun at @JRfm #Basics4Babies Day @langleyevents on Sunday: Ask Travis Lulay to get his face painted like Tony The Tiger  #worthashot	1
They don't even listen to ur order talk about great customer service :thumbs_down_sign:	1
it was  RT @bobthegreatooo @mikewickett how is that a spoiler alert?  Haven't so called 'experts' predicted him as being the winner?	0
Love that I can count on people. 	1
Why am I sick? *looks at other tweets* oh yeah sex...  #lame	1
I just earned the 'Land of the Free (Level 25)' badge on @untappd! http://t.co/m3QyB8Sr7w	0
The fans needs to be heard tho RT @cupcake78318778: @Sum4uckingMoney @jonso4tindo WENGER WILL NEVER QUITT.SORRY LADS. FOR FEW YEARS..	0
 in #Iowa. Anti-Union Governor #Branstad having inauguration & ball at #CommunityChoice Credit Union Center. A slap to #AFSCME #Homan	1
SAIC Design Directors on Trends and Advice to Students http://t.co/x176gUuhL0	0
internet got me like :weary_face: #stillalive  http://t.co/q7cK7aQnQZ	1
Had no sleep and have got school now  happy:pouting_face:	0
